{"asset_ref":{"asset_id":"ast_00000000000000af","library_id":"prj_0000000000000001","server_id":"6f1c2a52-3c2e-4d4b-9a57-0b6f6f0c1d2e","version_id":"ver_00000000000000v1"},"delivery_id":"dlv_00000000000000d4","dependencies":[{"asset_key":"3e4cecabdb6c9bac29d5f9c655852e10f1d96abdb437cee386bfecf3974b1cbf","asset_ref":{"asset_id":"ast_00000000000000aa","library_id":"prj_0000000000000001","server_id":"6f1c2a52-3c2e-4d4b-9a57-0b6f6f0c1d2e","version_id":"ver_00000000000000v1"},"delivery_id":"dlv_00000000000000d1","descriptor_sha256":"5b8517a39e3892184c5df6b733884265adae4289345cca8bd6172ffab15fb49b","manifest_sha256":"3af631546729db64d1b19e56406e7c5f1787f2801e1fa953c86e467714c4f011","representation":"portable_glb_v1"}],"descriptor_sha256":"1a588f1ae32858b0cd1cd3a5cdf2b7f041f89ef081d5785298191dba79a6332a","entrypoint":"source.zip","files":[{"artifact_id":"art_haje7ba12hw4zpxx","media_type":"application/zip","path":"source.zip","sha256":"73b047ea781a495cbb9a04a423f1cf9083b756f120dae0c249bbb99a4cbb5a7e","size":2301}],"preparer":{"name":"assetstudio-fixtures","version":"1.0.0"},"profile_id":"godot-static-source","profile_version":"1.0.0","representation":"godot_static_source_v1","required_capabilities":["godot_text_scene_v1"],"schema_version":1}