{"asset_ref":{"asset_id":"ast_00000000000000ab","library_id":"prj_0000000000000001","server_id":"6f1c2a52-3c2e-4d4b-9a57-0b6f6f0c1d2e","version_id":"ver_00000000000000v1"},"delivery_id":"dlv_00000000000000d3","dependencies":[],"descriptor_sha256":"f0ca92fcdbc3b73ec52368acfa4bfe8efbca20af55067e9c86fcda4b3a4e462b","entrypoint":"source.zip","files":[{"artifact_id":"art_b2t2nzbbcvn137sp","media_type":"application/zip","path":"source.zip","sha256":"ad93ae391d379335c1c430690044fa685fbcf9390fce5d4b1c0df5fa0e1d6c88","size":12540}],"preparer":{"name":"assetstudio-fixtures","version":"1.0.0"},"profile_id":"godot-static-source","profile_version":"1.0.0","representation":"godot_static_source_v1","required_capabilities":["godot_text_scene_v1","pbr_textures","alpha_mask"],"schema_version":1}