{"asset_ref":{"asset_id":"ast_00000000000000aa","library_id":"prj_0000000000000001","server_id":"6f1c2a52-3c2e-4d4b-9a57-0b6f6f0c1d2e","version_id":"ver_00000000000000v2"},"delivery_id":"dlv_00000000000000d2","dependencies":[],"descriptor_sha256":"cddb2fdecc889f788d6f2965e15fde4c04c67574e63fe1d981543c9715dbd861","entrypoint":"portable.glb","files":[{"artifact_id":"art_x66r7414ppmbv91b","media_type":"model/gltf-binary","path":"portable.glb","sha256":"02c2bea5a4f6e2e9182b5240d40d0ebcfd11888aa7b9c041c927601b281d5a86","size":1396}],"preparer":{"name":"assetstudio-fixtures","version":"1.0.0"},"profile_id":"portable-default","profile_version":"1.0.0","representation":"portable_glb_v1","required_capabilities":[],"schema_version":1}